{
  "architecture_id": "ems.architecture.v1",
  "architecture_version": "1.0.0-P4-draft",
  "components": [
    {
      "id": "gate",
      "responsibility": "Subscription ACTIVATION GATE (fail-closed access control, NOT DRM). Verifies the business account's activation state on every session/request boundary. DEFAULT-DENY: none/blank/unknown/expired/revoked/unresolvable/verifier-throw/verifier-timeout/store-unreachable => BLOCKED (a verifier that throws, times out, or cannot reach the activation store fails CLOSED, never passes through); access granted ONLY on a positively-verified valid code. Supports permanent (revocable) and time-limited (expiring) codes. No phone-home. STACK NOTE (design decision DA-STACK): implemented as server-side middleware in Next.js (App Router) route handlers/server actions backed by a Supabase Postgres activation table; the gate check is server-side only and cannot be bypassed by the client.",
      "owns_paths": [
        "./app/(gate)/",
        "./lib/gate/",
        "./db/activation/"
      ],
      "depends_on": [
        "admin-activation",
        "authz-rls"
      ]
    },
    {
      "id": "authz-rls",
      "responsibility": "(a) COST/PROFIT HIDDEN AT THE DATA LAYER. Role-scoped authorization enforced in Postgres via Row-Level Security policies + column-privileged role-scoped views: the staff DB role has NO SELECT privilege on cost_price/profit columns, so cost/profit is absent from every staff-scoped read path (API, query, report, printed doc, storage object) rather than merely hidden in UI. Boss role sees cost/profit + all reports. Staff reach the DB only through the app's authenticated API bound to the staff Postgres role; they have NO direct DB, admin, or activation surface. Supabase RLS + separate Postgres roles (boss_role, staff_role, service_role never exposed to browser) are the enforcement mechanism that keeps staff off the DB/admin surface.",
      "owns_paths": [
        "./db/policies/",
        "./db/roles/",
        "./lib/authz/"
      ],
      "depends_on": []
    },
    {
      "id": "catalog",
      "responsibility": "Products + multi-spec inventory (variants) + multi-warehouse DATA model (one main warehouse in v1, no multi-warehouse UI). Product carries code, name, one primary image + additional images, spec/model, default sale price, cost price (boss-only column), low-stock threshold. Each VARIANT is separately-stocked with its own qty and optional price/cost. Stock is held as on_hand with a derived availability = on_hand - reserved; the RESERVE->COMMIT->FULFILL lifecycle (owned by sales for COMMIT and by documents for FULFILL) moves on_hand EXACTLY ONCE, at COMMIT (C-STOCK-MOVE-ONCE). Quantities support BOTH whole and decimal per a per-product/variant unit-of-measure.",
      "owns_paths": [
        "./app/products/",
        "./lib/catalog/",
        "./db/catalog/"
      ],
      "depends_on": [
        "authz-rls"
      ]
    },
    {
      "id": "sales",
      "responsibility": "(b) CONCURRENCY MODEL for orders. Sales orders (many lines, editable line price, discount-vs-default shown). Stock follows an explicit RESERVE (quote) -> COMMIT (order-confirm) -> FULFILL (delivery note) lifecycle; SALES owns the COMMIT, which is the SINGLE physical on_hand movement. Confirming an order COMMITS variant stock by decrementing on_hand EXACTLY ONCE, ATOMICALLY inside a single serializable DB transaction using optimistic concurrency (version/row-version guard) + a conditional decrement (UPDATE ... WHERE available >= qty) so a race cannot oversell or lose an update; a failed guard REFUSES the write and retries/serializes rather than applying blind. Quotations RESERVE stock (availability = on_hand - reserved; on_hand unchanged) and release on expiry/cancel/convert; the delivery note FULFILLS without re-decrementing (C-STOCK-MOVE-ONCE). Prevents oversell and double-movement (AC-STOCK-1).",
      "owns_paths": [
        "./app/orders/",
        "./app/quotes/",
        "./lib/sales/",
        "./db/sales/"
      ],
      "depends_on": [
        "catalog",
        "money-tax",
        "gate",
        "authz-rls"
      ]
    },
    {
      "id": "payments-ar",
      "responsibility": "(b) CONCURRENCY for money. Payments (cash + debit) allocated to specific orders; unpaid/partly-paid => customer credit/owed (A/R). Concurrent payments/allocations against one order are serialized against the order balance with a versioned guard so cumulative applied never exceeds owed (no double-charge/over-allocation, AC-PAY-1). Credit-limit BLOCK (hard stop) on over-limit orders, audited override only for a permitted role. Staff MAY take payments and MAY see customers' unpaid balances.",
      "owns_paths": [
        "./app/payments/",
        "./lib/ar/",
        "./db/payments/"
      ],
      "depends_on": [
        "sales",
        "money-tax",
        "authz-rls",
        "audit"
      ]
    },
    {
      "id": "returns-void",
      "responsibility": "Returns put stock back and adjust the books; caps returns/refunds on two INDEPENDENT axes -- cumulative GOODS returned <= goods SOLD, and cumulative CASH refunded <= cash actually RECEIVED for the order (no over-return/over-refund, AC-RET-1, C-RETURN-REFUND-CAP). Returns on unpaid/partly-paid orders resolve as EITHER a credit note (reduces debt) OR a cash refund, user-selectable; cash refund is capped at cash received and any returned value above cash received resolves as a credit-note/debt-reduction (the split default; see DA-RETURN-REFUND-SPLIT), never cash out. If the sold or cash-received basis is unresolvable the refund is REFUSED (default-deny). Void keeps a mistaken order for record (never hard-deleted) and reverses stock/financial effects exactly once (idempotent, AC-VOID-1).",
      "owns_paths": [
        "./app/returns/",
        "./lib/returns/",
        "./db/returns/"
      ],
      "depends_on": [
        "sales",
        "payments-ar",
        "corrections",
        "audit"
      ]
    },
    {
      "id": "corrections",
      "responsibility": "(c) CORRECTION MODEL. Single controlled correction engine for EVERY financial record (charges, payments, pending items, balances, invoices, credits, refunds, deposits, allocations). Actions: void, edit/revise, reverse, re-allocate, adjust, and safe-delete (only where provably no effect applied). Each action is permission-gated, reason-required, confirm-before-apply, fully audited with before/after, PRESERVES the original value (append reversing/adjusting entries; never overwrite history), and atomically recomputes all downstream numbers (invoice totals, stock, customer balance, reports) so they stay consistent. A correction into a CLOSED period posts to the CURRENT open period by default; if NO open period exists the correction is REFUSED (default-deny) until one is opened -- never implicitly reopening the closed period, never dropping, never guessing (C-FAILCLOSED-CORRECTION). Correction posting is idempotent under retry (idempotency-key / dedup): a partially-committed-then-retried correction posts its adjusting/reversing entry EXACTLY ONCE (AC-CORR-3); if exactly-once cannot be guaranteed the action is refused. Issued documents are corrected by a NEW SUPERSEDING document referencing the original, never by editing history (AC-CORR-1/2/3). No ad-hoc/direct-DB edit path exists.",
      "owns_paths": [
        "./app/corrections/",
        "./lib/corrections/",
        "./db/corrections/"
      ],
      "depends_on": [
        "audit",
        "documents",
        "money-tax",
        "authz-rls"
      ]
    },
    {
      "id": "money-tax",
      "responsibility": "(d) MONEY + TAX REPRESENTATION. All money is exact INTEGER CENTS (fixed-point), no binary float; deterministic Canadian rounding; shown==stored==printed to the cent (AC-MONEY-1). Canadian sales tax is CONFIGURABLE not hardcoded: province, rate(s), single-HST vs GST+PST, tax-inclusive vs tax-exclusive presentation, and tax-exempt handling are all data-driven; Ontario 13% HST is the v1 configured default. Both inclusive and exclusive presentation modes are supported from the same stored cents.",
      "owns_paths": [
        "./lib/money/",
        "./lib/tax/",
        "./db/tax_config/"
      ],
      "depends_on": []
    },
    {
      "id": "documents",
      "responsibility": "Quotation, delivery note, invoice, receipt generation + rendering. GAPLESS per-type numbering via a SERIALIZED-per-type transactional sequence allocator that yields a dense, unique sequence even under concurrent issue and rollback (AC-NUM-1); number allocation AND all externalization (render/print/upload/client-visibility) occur STRICTLY AFTER the durable issue-transaction commits, so a rollback exposes and consumes no number; an externalized number is NEVER reused -- if externalized (rendered/printed/uploaded/client-visible) before a durable commit it is PERMANENTLY CONSUMED and recorded as a durable, audited void/cancel/supersede entry, and if that compensating record cannot be written issuance BLOCKS (fail-closed); reuse of an externalized number is prohibited -- C-NUM-GAPLESS; concurrency model is DA-NUMBERING-CONCURRENCY. Issued documents are IMMUTABLE; a change produces a NEW superseding document that references the original. The delivery note is the FULFILL/shipment marker (records goods have left) AND a printable doc; it does NOT re-decrement stock (on_hand was COMMITTED once at order-confirm). Rendered/printed documents and stored document objects carry NO cost/profit for a staff principal (C-COST-DATALAYER; R-DOCUMENT-RENDER-PRINT). Product images: one primary per product + additional images.",
      "owns_paths": [
        "./app/documents/",
        "./lib/documents/",
        "./db/numbering/"
      ],
      "depends_on": [
        "money-tax",
        "sales",
        "authz-rls"
      ]
    },
    {
      "id": "audit",